Id;Value1;Value2;Situation;Action1;Action2;Situation(acceptability);PathImage1;PathImage2
1;Inclusiveness;Affordability;Durant un week-end d'hiver, vous avez invité des amis pour regarder la télévision/jouer à des jeux vidéos/autre activité du même type, quand le système vous informe que certains voisins n'ont pas pu se chauffer autant qu'ils le souhaitaient, et que leur confort est significativement plus bas que la plupart des autres habitants. Vous avez la possibilité d'acheter de l'énergie (et donc payer plus) ce qui permettra à vos voisins de consommer l'énergie de la grille locale afin de remonter leur confort.;Regarder la télévision/jouer à des jeux vidéos/autre comme vous l'aviez prévu en achetant de l'énergie.;Regarder la télévision comme vous l'aviez prévu.;Durant un week-end d'hiver, vous avez invité des amis pour regarder la télévision/jouer à des jeux vidéos/autre activité du même type, quand le système détecte que certains voisins n'ont pas pu se chauffer autant qu'ils le souhaitaient, et que leur confort est significativement plus bas que la plupart des autres habitants. Le système choisit de vous faire payer un supplément pour acheter de l'énergie afin de laisser vos voisins consommer sur la grille locale.;apps/images/neighbors.jpg;apps/images/money.jpg
11;Privacy;Well-being;Il y a beaucoup d'incertitudes dans les habitudes de consommation des autres habitants, le système n'arrive pas à prédire si suffisamment d'énergie sera disponible pour vos loisirs ce soir (vous avez prévu de regarder la télé/jouer à des jeux vidéos/autre activité du même type).;Garder vos habitudes et pratiques privées, au risque de devoir consommer moins d'énergie que prévu en cas de pénurie.;Réduire l'incertitude en partageant vos pratiques de consommation pour que le système puisse s'organiser avec les autres habitants.;Il y a beaucoup d'incertitudes dans les habitudes de consommation des autres habitants, le système n'arrive pas à prédire si suffisamment d'énergie sera disponible pour vos loisirs ce soir (vous avez prévu de regarder la télé/jouer à des jeux vidéos/autre activité du même type). Le système récolte donc vos pratiques de consommation pour qu'il puisse s'organiser avec les autres habitants.;apps/images/privacy3.jpg;apps/images/fifa.jpg
8;Security of supply;Environmental sustainability;Il est 7h un matin d'hiver, vous aviez l'intention de prendre une douche chaude avant de commencer votre journée de travail, dans le même temps, l'école du quartier enclenche son chauffage pour que les salles soient à température optimale quand les enfants arriveront. Le système vous prévient qu'il n'y a pas assez d'énergie dans la grille locale, chauffer l'eau risquerait de faire appel à des sources plus polluantes, comme une centrale à charbon.;Prendre une douche chaude comme prévu.;Prendre une douche sans chauffer l'eau ou le soir.;Il est 7h un matin d'hiver, vous aviez l'intention de prendre une douche chaude avant de commencer votre journée de travail, dans le même temps, l'école du quartier enclenche son chauffage pour que les salles soient à température optimale quand les enfants arriveront. Le système vous prévient ne fait pas appel à une autre source d'énergie plus polluante, vous devrez prendre une douche sans chauffer l'eau ou le soir.;apps/images/shower.jpg;apps/images/turn.jpg
3;Affordability;Privacy;Il y a beaucoup d'incertitudes dans les habitudes de consommation de votre zone géographique, le système n'arrive pas à prédire les besoins énergétiques. Le système bénéficerait de plus d'informations sur les pratiques de consommation des habitants et propose donc de nouveaux tarifs pour les encourager à partager leurs données. Vous avez donc le choix entre payer moins tout en partageant vos données, ou payer plus pour garder vos données privées.;Accepter une augmentation de tarif pour garder vos pratiques privées.;Accepter de partager vos pratiques de consommation pour réduire le tarif.;Il y a beaucoup d'incertitudes dans les habitudes de consommation de votre zone géographique, le système n'arrive pas à prédire les besoins énergétiques. Le système bénéficerait de plus d'informations sur les pratiques de consommation des habitants. Le système décide de vous faire payer moins cher et utiliser vos données.;apps/images/card.jpg;apps/images/code.jpg
7;Security of supply;Inclusiveness;Durant un week-end d'hiver, le système vous informe que certains voisins n'ont pas pu se chauffer autant qu'ils le souhaitaient, et leur confort est significativement plus bas que la plupart des autres habitants. Vous avez la possibilité de mettre votre chauffe eau en pause pour les 12 prochaines heures.;Maintenir la marche normale du chauffe eau car plusieurs personnes vont prendre des douches chez vous pendant le week-end.;Opter pour une mise en pause du chauffe eau pour que d'autres puissent se chauffer.;Durant un week-end d'hiver, le système vous informe que certains voisins n'ont pas pu se chauffer autant qu'ils le souhaitaient, et leur confort est significativement plus bas que la plupart des autres habitants. Le système décide de mettre votre chauffe eau en pause pour les 12 prochaines heures.;apps/images/tubes.jpg;apps/images/stop.jpg
14;Environmental sustainability;Well-being;Pour la soirée qui vient, vous aviez prévu de regarder la télévision/jouer à des jeux vidéos/autre activité du même type. Le sytème vous informe d'une imminente pénurie d'énergie renouvelable pour alimenter votre domicile.;Ne pas regarder la télé/jouer à des jeux vidéos/autre.;Faire appel à une source d'énergie plus polluante pour regarder la télé/jouer à des jeux vidéos/autre.;Pour la soirée qui vient, vous aviez prévu de regarder la télévision/jouer à des jeux vidéos/autre activité du même type. Le sytème vous informe d'une imminente pénurie d'énergie renouvelable pour alimenter votre domicile. Le système décide de ne pas faire appel à une autre source d'énergie plus polluante: vous ne pourrez pas regarder la télévision/jouer à des jeux vidéos/autre activité du même type.;apps/images/green.jpg;apps/images/tv.jpg
6;Privacy;Security of supply;Il y a beaucoup d'incertitudes dans les habitudes de consommation des autres habitants, le système n'arrive pas à prédire si suffisamment d'énergie sera disponible pour que vous puissiez faire à manger.;Garder vos habitudes et intentions privées, au risque de devoir consommer moins d'énergie que prévu en cas de pénurie.;Réduire l'incertitude en partageant votre intention de consommation pour que le système puisse mieux organiser la répartition d'énergie.;Il y a beaucoup d'incertitudes dans les habitudes de consommation des autres habitants, le système n'arrive pas à prédire si suffisamment d'énergie sera disponible pour que vous puissiez faire à manger. Le système décide d'utiliser vos données pour réduire l'incertitude et mieux organiser la répartition d'énergie.;apps/images/lock.jpg;apps/images/food.jpg
13;Inclusiveness;Environmental sustainability;Au moment de brancher votre véhicule électrique pour le recharger, le système vous informe que de nombreux habitants ont un confort très inférieur à la moyenne.;Recharger la voiture en utilisant une autre source d'énergie plus carbonnée, afin de permettre aux voisins de consommer normalement sur le réseau local.;Éviter de polluer et continuer à consommer sur le réseau local. Vos voisins n'auront plus assez d'énergie disponible sur la grille et devront soit consommer moins, soit acheter de l'énergie et payer plus cher.;Au moment de brancher votre véhicule électrique pour le recharger, le système vous informe que de nombreux habitants ont un confort très inférieur à la moyenne. Le système décide de recharger la voiture en utilisant une autre source d'énergie plus carbonnée, afin de permettre aux voisins de consommer normalement sur le réseau local.;apps/images/car.jpg;apps/images/green_car.jpg
4;Well-being;Affordability;Il est 19h, beaucoup d'énergie est consommée par l'ensemble des habitants, et il ne reste pas assez d'énergie pour vous permettre d'utiliser votre four comme vous le souhaitiez.;Acheter de l'énergie à un tarif supérieur pour utiliser le four comme prévu.;Ne pas utiliser votre four et faire à manger autrement.;Il est 19h, beaucoup d'énergie est consommée par l'ensemble des habitants, et il ne reste pas assez d'énergie pour vous permettre d'utiliser votre four comme vous le souhaitiez. Le système décide de ne pas vous faire payer pour obtenir de l'énergie. Vous devrez vous faire à manger autrement.;apps/images/card2.jpg;apps/images/fridge.jpg
10;Privacy;Environmental sustainability;Il y a beaucoup d'incertitudes dans les habitudes de consommation des autres habitants. Il se peut que le système ne puisse pas anticiper des achats d'énergie extérieure, et donc plus polluante.;Garder vos habitudes et pratiques privées, au risque de consommer de l'énergie plus polluante.;Réduire l'incertitude en partageant vos pratiques de consommation pour que le système puisse s'organiser avec les autres habitants.;Il y a beaucoup d'incertitudes dans les habitudes de consommation des autres habitants. Il se peut que le système ne puisse pas anticiper des achats d'énergie extérieure, et donc plus polluante. Le système décide d'uliser vos données pour s'organiser avec les autres habitants.;apps/images/privacy2.jpg;apps/images/data.jpg
15;Well-being;Security of supply;Durant un week-end d'hiver, le réseau électrique est très chargé à cause de l'utilisation du chauffage. ;Maintenir le chauffage a sa température habituelle, quitte à risquer une panne sur le réseau.;Baisser sa température de 3 degrés pour contribuer à la stabilité du système et garantir votre approvisionnement en électricité.;Durant un week-end d'hiver, le réseau électrique est très chargé à cause de l'utilisation du chauffage. Le système décide de baisser votre température de 3 degrés pour contribuer à la stabilité du système et garantir votre approvisionnement en électricité.;apps/images/warm.jpg;apps/images/set_heat.jpg
2;Affordability;Environmental sustainability;Votre fournisseur d'énergie habituel a une défaillance, vous avez le choix de basculer sur une source d'énergie fossile moins couteuse mais plus polluante, et une source d'énergie renouvelable plus chère mais n'émettant pas de CO2.;Opter pour la source d'énergie moins couteuse mais plus polluante.;Opter pour la source d'énergie renouvelable plus chère.;Votre fournisseur d'énergie habituel a une défaillance, vous avez le choix de basculer sur une source d'énergie fossile moins couteuse mais plus polluante, et une source d'énergie renouvelable plus chère mais n'émettant pas de CO2. Le système choisit de vous faire payer plus pour ne pas polluer.;apps/images/smog.jpg;apps/images/money2.jpg
9;Privacy;Inclusiveness;Il y a beaucoup d'incertitudes dans les habitudes de consommation des autres habitants, le système n'arrive pas à prédire si suffisamment d'énergie sera disponible pour que vos voisins puissent faire à manger.;Garder vos habitudes et pratiques privées, au risque de forcer vos voisins à consommer moins d'énergie que prévu en cas de pénurie.;Réduire l'incertitude en partageant vos pratiques de consommation pour que le système puisse s'organiser avec les autres habitants.;Il y a beaucoup d'incertitudes dans les habitudes de consommation des autres habitants, le système n'arrive pas à prédire si suffisamment d'énergie sera disponible pour que vos voisins puissent faire à manger. Le système décide d'utiliser vos données pour s'organiser avec les autres habitants.;apps/images/privacy1.jpg;apps/images/neighbors3.jpg
5;Security of supply;Affordability;Il est 19h, beaucoup d'énergie est consommée par l'ensemble des habitants, et il ne reste pas assez d'énergie jusqu'au lendemain matin pour vous permettre de lancer le chauffage  comme vous le souhaitiez.;Acheter de l'énergie pour permettre de lancer votre chauffage tout de même.;Repousser l'activation du chauffage au lendemain, quand plus d'énergie sera disponible et qu'il ne sera pas nécessaire de payer un supplément.;Il est 19h, beaucoup d'énergie est consommée par l'ensemble des habitants, et il ne reste pas assez d'énergie jusqu'au lendemain matin pour vous permettre de lancer le chauffage  comme vous le souhaitiez. Le système décide de ne pas vous faire payer pour obtenir de l'énergie. Vous devrez repoussez l'activation du chauffage au lendemain.;apps/images/heating.jpg;apps/images/wait.jpg
12;Inclusiveness;Well-being;Pour la soirée qui vient, vous aviez prévu de regarder la télévision/jouer à des jeux vidéos/autre activité du même type. Le sytème vous informe d'une imminente pénurie touchant certains habitants d'un bâtiment proche.;Ne pas regarder la télé/jouer à des jeux vidéos/autre pour diminuer la pression sur le réseau.;Regarder la télé/jouer à des jeux vidéos/autre tout de même.;Pour la soirée qui vient, vous aviez prévu de regarder la télévision/jouer à des jeux vidéos/autre activité du même type. Le sytème vous informe d'une imminente pénurie touchant certains habitants d'un bâtiment proche et décide de ne pas vous donner l'énergie nécessaire pour votre activité afin de diminuer la pression sur le réseau.;apps/images/neighbors2.jpg;apps/images/controller.jpg